{
  "acceptance_tests": [
    {
      "evidence_artifact": "Pinned benchmark-fit manifest; deterministic replay hashes; leakage-predictor and oracle audit reports.",
      "expected": "Controlled world passes oracle, action-binding shuffle, counterfactual-twin, and predictor thresholds; external roster produces either a frozen selected benchmark or the declared failure disposition.",
      "falsifies": "Any claim that the task requires lived causal learning rather than target/state/signature leakage, or that an external-development result is available.",
      "kind": "invariant",
      "required_before": "gpu_run",
      "setup": "Run the controlled-world audits and the fixed DiscoveryWorld-first, ScienceWorld-fallback CPU fit gate exactly as specified.",
      "test_id": "AT01_environment_and_leakage_fit"
    },
    {
      "evidence_artifact": "Atomic writer/read fixtures with provenance, lifecycle, shortcut-admission, and negative-corpus receipts.",
      "expected": "Witnessed atoms, relations, exceptions, and one legal shortcut can be written and read; invalid, stale, unsupported, cyclic, or complete-solution records are rejected.",
      "falsifies": "The claimed memory contract if the system cannot distinguish admissible local experiential structure from unsupported or answer-bearing material.",
      "kind": "unit",
      "required_before": "gpu_run",
      "setup": "Exercise every lifecycle transition, evidence-equivalence case, valid diamond, forbidden cycle, and corpus eligibility class.",
      "test_id": "AT02_atomic_memory_contract"
    },
    {
      "evidence_artifact": "Read-only common-deck manifests, state hashes before/after evaluation, scorer write-denial logs, and reset receipts.",
      "expected": "All common-deck arms see identical public streams and frozen reader budgets; evaluation leaves source-life bytes unchanged and sealed outcomes cannot enter cognition.",
      "falsifies": "Fixed-deck attribution if evaluation or arm-specific experience changes the life state.",
      "kind": "invariant",
      "required_before": "gpu_run",
      "setup": "Run every arm on the same ordered stream, then adversarially attempt evaluator/scorer writes and verify byte-identical source-life hashes.",
      "test_id": "AT03_common_deck_isolation"
    },
    {
      "evidence_artifact": "Per-arm corpus hashes, reader receipts, resource ledger, calibration result table, and mandatory-arm failure report.",
      "expected": "Mandatory P0/P1/P2/P3C/P4/P5T/P5L/P6 implementations are present, matched where comparison requires matching, and report any failed cell rather than omitting it.",
      "falsifies": "A comparative compiler or substrate conclusion if corpus, reader, thinker, budget, or baseline implementation differs without separate labeling.",
      "kind": "baseline",
      "required_before": "scientific_claim",
      "setup": "Use the fixed common deck at frozen checkpoints; compare the declared mandatory arms and preserve active/retained bytes, compute, and token ledgers.",
      "test_id": "AT04_mechanism_and_baseline_suite"
    },
    {
      "evidence_artifact": "Capability-family fixtures, shortcut collision audit, action traces, revision traces, and per-family scores.",
      "expected": "A0 is diagnostic only; A1-A4 meet their construction definitions, no shortcut ends an A3/A4 goal, and exception evidence can cause a supported revision and recovery.",
      "falsifies": "A constructive action claim if gains reduce to witnessed lookup, a stored final plan, or unrevised false memory.",
      "kind": "end_to_end",
      "required_before": "scientific_claim",
      "setup": "Evaluate frozen A0-A4 decks with four-to-six-action A3/A4 goals, paired twins, and controlled exception/rule-change cases.",
      "test_id": "AT05_constructive_action_and_revision"
    },
    {
      "evidence_artifact": "Seeded-prefix replay hashes, clone manifests, randomized memory-assignment ledger, sealed branch-outcome store, and paired estimand report.",
      "expected": "Valid clones begin from the same canonical state, receive only assigned memory, preserve action budgets, and never return branch outcomes to the source life.",
      "falsifies": "The on-policy flywheel claim if clone semantics are invalid, memory assignment is not causal, or branch outcomes contaminate training.",
      "kind": "end_to_end",
      "required_before": "scientific_claim",
      "setup": "Replay a public prefix, reject hash-mismatched clones, randomize memory at the branch boundary, and evaluate independent sealed decks afterward.",
      "test_id": "AT06_on_policy_flywheel"
    },
    {
      "evidence_artifact": "Independent-review report over frozen code, manifests, prompts, models, budgets, inputs, outputs, and claim boundary; separate author-side advocate response.",
      "expected": "A fresh reviewer finds no unresolved leakage, attribution, protocol, or artifact-binding defect; any repaired defect receives a new bound review.",
      "falsifies": "Eligibility for a GPU science run or scientific promotion when independent review rejects the exact frozen evidence.",
      "kind": "independent_review",
      "required_before": "gpu_run",
      "setup": "Review the exact ratified implementation and evidence bundle; the advocate may clarify or repair but may not override the reviewer.",
      "test_id": "AT07_independent_review_gate"
    },
    {
      "evidence_artifact": "Append-only claim/status log and adversarial provenance fixtures.",
      "expected": "Chronology, root-event equivalence, immutable revisions, valid diamonds, rejected cycles, and supported-only positive corpus admission all hold mechanically.",
      "falsifies": "The claim that dreaming adds evidence-preserving local structure rather than laundering repeated or future-derived text into memory.",
      "kind": "invariant",
      "required_before": "gpu_run",
      "setup": "Test all status transitions plus paraphrase/reverse/cloze descendants, shared-root diamonds, self-citation, descendant citation, and revision cases.",
      "test_id": "AT08_semantic_lifecycle_and_provenance"
    },
    {
      "evidence_artifact": "Visibility/taint test report, agenda-laundering attempts, branch-release fixtures, cross-life canary report, and cache/process reset receipts.",
      "expected": "Forbidden information is inaccessible; agendas select evidence only; terminal branches cannot become positive memory; new lives reject all prior-life canaries.",
      "falsifies": "The visibility contract if a workspace, agenda, evaluation, scorer, audit, cache, or prior-life artifact reaches cognition or positive training.",
      "kind": "invariant",
      "required_before": "gpu_run",
      "setup": "Attempt candidate-answer, target-ID, hidden-truth, evaluator-output, and old-life canary injection at every stage.",
      "test_id": "AT09_visibility_taint_and_reset"
    },
    {
      "evidence_artifact": "Same-corpus factorial table with common-reader receipts, native-interface report, atoms-versus-shortcuts results, and active/retained resource ledger.",
      "expected": "P5T and P5L share accepted semantic bytes; common-interface comparisons hold reader/candidate/thinking policy fixed; P3N is separately labeled; P5S isolates legal shortcut materialization from atoms.",
      "falsifies": "Attribution to LoRA, dreaming, shortcuts, or a graph substrate when the observed benefit is supplied by a different reader, candidate universe, or thinker budget.",
      "kind": "ablation",
      "required_before": "scientific_claim",
      "setup": "Run text, LoRA, atoms-only, legal-shortcut, shuffled-binding, and native-graph variants under frozen query and resource interfaces.",
      "test_id": "AT10_reader_substrate_thinker_factorial"
    },
    {
      "evidence_artifact": "Locked split manifest, checkpoint curves, paired bootstrap intervals, randomization-test output, Holm-adjusted secondary results, and negative-result decision record.",
      "expected": "Primary endpoint, onset rule, missing-cell handling, replication unit, and all negative/mixed result dispositions are applied without post-hoc goalpost changes.",
      "falsifies": "Any headline claim not supported by the preregistered P5S contrast, developmental contrast, and locked-world analysis.",
      "kind": "baseline",
      "required_before": "scientific_claim",
      "setup": "After development-only rank selection, run the frozen confirmation schedule on 24 new locked paired world-lives and preserve every cell.",
      "test_id": "AT11_statistics_splits_and_negative_decisions"
    },
    {
      "evidence_artifact": "Content-addressed phase manifests, crash-at-every-phase replay report, malformed-output corpus, deterministic-resume hashes, and quarantined-partial-run receipts.",
      "expected": "Malformed or multi-operation output fails closed; every phase resumes only from a valid sealed predecessor; restart/replay produces bound manifests and deterministic state.",
      "falsifies": "Scientific reproducibility or any result whose runtime/parser state cannot be reconstructed from durable artifacts.",
      "kind": "invariant",
      "required_before": "gpu_run",
      "setup": "Inject crashes at every phase and malformed schemas at every cognitive call; compare resulting sealed manifests and replay hashes.",
      "test_id": "AT12_runtime_artifact_and_resume_integrity"
    }
  ],
  "artifact_type": "architecture_change",
  "change_id": "chg_20260901_developmental_protocol_v2",
  "claim_delta": {
    "claims": [
      {
        "after": "The protocol, if its pre-GPU gates pass, establishes only a faithful and auditable testbed for per-life experiential-memory hypotheses; it establishes no behavioral or scientific success by itself.",
        "before": "The prior v1 proposal was unratified and lacked a fully bound executable protocol.",
        "claim_id": "C0_protocol_fidelity",